angry,my girlfriend does practice and therefore leaves me alone at night and in the weekend in addition she is very busy doing several things so we dont see each other often
sad,my father suddenly fell ill he stayed for months in the hospital the last month on intensive care of the academic hospital then he died
happy,i thought that someone was angry with me but by hindsight that didnt appear to be the case he even liked me
angry,my parents thought that i didnt do my best to pass the final examination secondary school when i achieved a good grade they said nothing but if i had had a bad grade they would have become very angry
sad,when i caused much pain and sorrow to my boyfriend by finishing our relationship
happy,a meeting and a conversation with a woman somewhat elder than me who considers me as her child she also has one child of her own last two years i lived with her no relationship
angry,when talking with my sister she often ventilates prejudices which my father also adheres
sad,i was in a hopeless situation in a dirty place no study no work only loneliness
happy,when i passed the driving test already on the first try although i felt more and more uncertain as the day came near
angry,when i arranged our holiday in paris and my girlfriend raised criticisms all the time
sad,when it suddenly appeared that our dog was dangerously ill and probably would die we had not expected this because he was always very healthy fortunately he survived because we in turn gave him medicines during the night
happy,passing an examination although i felt sure i had failed
angry,i suffer from a disease of my muscles therefore i am only able to attend lectures for half a day so sometimes i miss obligatory lectures however the teachers do not take into account my disease and punish me with detention work resulting in an overload
sad,i suffer form a disease of my muscles however i cannot talk about it and my feelings the consequence with my parents they try to repress it
angry,when a pickpocket robbed me of my money k while i was buying bathing soap
sad,when i failed the grade seven examination
happy,the day i learnt that i had been admitted to the university
angry,in a sadist provoked my sister in my presence he tried to force my sister into accompanying him to his place but my sister did not agree and so she was kicked and she fell down there was a fight
sad,when my father passed away in i was left alone with my mother who was very sick so i had to go and live with my aunt who is very short tempered till my mother was discharged from the hospital
happy,boy you have been admitted to the medicine school and your uncle is coming back fron canada next week my father told me and it was a happy moment
angry,when my mother quarrelled with my aunt over me
sad,my elder brother had been expelled from college and he was so frustated that he attempted suicide he drank bottle fragments i was very sad when i learnt this
happy,i won the first prize at the science fair the first of the kind at school and i was only in form ii then
angry,my younger brother destroyed and gave away some of the books that i had intended to keep for as long as possible
sad,when a close relative of mine passed away it was the first time that someone so close to me had died
happy,my st birthday celebration when i cut the cake and received the presents
angry,when some seniors tried to scold and insult some juniors on account of what the juniors were supposed to have said at secondary school
sad,when an uncle of mine who was close to me passed away after having had a stroke before his first daughter could be named
sad,my fianct left me for my best friend
happy,a recurrent lovesickness
angry,meddlesomeness of my mother about the way i live she thinks i am to free in my behavior for instance when a boyfriend stays the night
sad,the dying of a close member of the family
happy,when i passed a very important exam
angry,a friend came to visit me late one night he promised to stay only a quarter of an hour but he stayed hours he didnt leave and i was very angry
sad,i had to terminate a training because i wasnt suited for it i was very sad about this because i very much wanted to finish that training
happy,i went to visit friends and it was very companionable
angry,during military service a superior reproached me unjustly this led to friction in a lot of situations
sad,disappointed love the girl made an end to our relationship while i thought she was in love with me
happy,sitting alone in a quiet room concentrating on things happening around me which pleases me
angry,when a teacher tells a story which isnt true it only reflects his way of interpreting reality
sad,i have high expectations for my future but if i pursue the subject in this manner i will not attain this
happy,my sister and brother in law returned from sri lanka where they adopted a child i went to pick them up at the airport
angry,i work at a petrol station when there is a foreigner who wants petrol my collegues treat him very impolite
sad,an uncle of mine who just retired having worked hard all his life got a cerebral hemorrhage
happy,when i got my drivers licence
angry,the stories about the way my grandmother treated my mother
sad,when my mother was proved to suffer from a very serious disease
happy,every year during carnival i am very joyful i have an intense feeling of happiness then
angry,i am usually angry at myself this happens often for instace when i want to pet without falling in love and it soon proves that i have fallen in love with him
sad,losing a boyfriend for the second time to my friend he fell in love with her the same thing happened a few months earlier with another boyfriend
happy,when i came again in contact with a girl i liked very much and most important she also liked me
angry,after a hard day at the university i also had to make dinner that evening it failed because of a frying pan which broke
sad,when my father had a cerebral hemorrhage
happy,when an old schoolfriend phoned me to arrange an appointment to talk about old memories i hadnt seen him for years
angry,my older brother who gives me unwanted advices about problems in my relationship with my girlfriend
sad,my girlfriend left the house in which we lived together a few months ago this made me very sad
happy,occurs frequently a recent experience when going out with many friends nice music after the examinations i felt so happy i could have embraced everybody
angry,being treated unfairly and being hurt by someone i love
sad,when i finished a relation after four years leading to much sorrow for the other one and myself although it was the best solution
happy,i fell over head and ears in love with someone who appeared to be in love with me it made me so happy that i could hardly sleep and eat for one week
angry,i had a quarrel with my father because i was of the opinion that he decided in an authoritarian way which tv program we should watch i became very angry and started throwing things through the room
sad,my boyfriend finished our relationship when i started studying psychology in nijegen because then we would not be able to meet frequently anymore
happy,i was called and invited to have a talk about a job i wanted to have
angry,there was a lot of irritation between me and a person who lives in the same house where i live suddenly it became too much for me and i accused him of several things
sad,the end of a relationship after years by doing this i hurt the other person very much
happy,when a friend of me came for an unexpected visit
angry,when i was at an official meeting i asked a question to a person his response was not directed at me but at the chairman
sad,when the mother of a good friend of mine died
happy,after i saw my family and good friends back after staying one year in a foreign country
angry,i was in the library of medical psychology and walked into the wrong direction a man who came out of a room threated me very denigrating and i became very angry in a resisting manner
sad,a good friend of mine died during the funeral i felt an intense feeling of sadness
happy,when i go out with my friend with enough money and good sense to our favorite dancing
angry,a friend started to shout at me he called me an old frump
sad,my relationship with a boyfriend was finished and i didnt succeed a yearscourse
happy,when i made the winning goal during a very important football game
angry,seeing for the first time pictures about the so called treatment of jewish people in nazigermany during world war ii
sad,the death of my motherinlaw after a long sickbed at the moment of dying i was with her
happy,when it appeared that i was not pregnant when i was several weeks overtime
angry,once again my parents distroyed a relationship
sad,i had this feeling when my parents distroyed a relationship with a boy because they thought he was bad and irresponsible
sad,a sudden end to the relationship with my first girlfriend
happy,i felt joy when i heard that i was accepted for the free university in driebergen
angry,i felt anger when at the end of a telephone call a good friend told me that she would go to travel next year with another good friend we couldnt talk this out
sad,i was very sad when i had to leave persons with whom i had a very intense relationship i also had to leave the environment which was part of this
happy,when my boyfriend and i went out for a dinner and subsequently went to his family we had a very nice evening
angry,when i got the feeling that i had to do all the housekeeping while my boyfriend didnt do anything this happened in a period of exams when i had to study very hard
sad,when my best friend got a boyfriend because of this a relationship of ten years was finished abruptely
happy,the day i heard that i passed the high school exam
angry,we had to move to a very different city because the company where my father worked also moved to that place it was very difficult for me to make new friends than
sad,a very close friend of mine died i read it in the newspaper i didnt know what to do and thought about it the whole day
happy,when christmas holiday started i felt very joyful when i finished my last exam
angry,i was very angry at my father when he didnt give me as much money as my brother to use for studying once again my brother was better off then me
sad,when my gradmother died i felt very sad then the feeling started to be worse after a while
happy,my boyfriend was playing with my cat he was playing games with her and telling nice things to her
angry,my boyfriend told me that i had very high demands towards him in my opinion this was wrong
sad,i hadnt been at my parents place for a long time when i went to visit them i had high expectations but when i was there it was very different from what i expected
happy,during my high school time i succeeded to play a concert of mozart on the piano when i gave my first performance i succeeded to play it very well
angry,when our cat was killed in a caraccident i was very angry at the driver of the car because he didnt take enough care
sad,there is a boy who i love very much i asked him to have dinner with me but he refused i dont know why he didnt go with me but i felt very lonely
happy,when i saw a good friend again after not having seen her for a long time
angry,when people without my permission pry in my belongings and take things out of it
sad,when i noticed that my parents were not in such a prosperity as most people in my surroundings
happy,when i went to visit a friend in the hospital she had to undergo an operation for rupture i was glad to hear that the operation succeeded and that she was relieved of her pain
angry,i worked together with another student on a computerassignment she didnt do her best and didnt prepare herself for it she expected me to explain it to her
sad,i had a quarrel with a good friend about the fact that i didnt pay her a visit when she expected me to come hereafter i was very sad because it became a real quarrel
happy,when i got the positive result of my examination to achieve the bachelor degree in plychology
angry,my girlfriend one day went out and promised to be back at pm however she first arrived at pm without a message we had to go out that evening
sad,when my girlfriend decided to finish our relation
happy,when the girl with whom i am in love smiles at me
angry,when a discussion resulted in an insult which in my opinion was not justified
sad,when i realized that it did not make much sense to start a relationship with a girl who was not very constructive to establish a firm relationship
happy,on my birthday when several good friends came to visit me
angry,my father called me behind my mothers back and told me that my mother disapproved my behavior in the weekend however he didnt tell me the details and left me with unanswered questions
sad,i felt very lonely was very dissatisfied with myself when i realised that i could feel very jealous of other women because of my boyfriend
happy,i felt joyful when my boyfriend met me at the station while at first he had said that he would not do that
angry,when someone does not listen to me after having asked me to repeat what i said this happened more than one time with the same person
sad,i felt very sad when i heard that a friend had committed suicide
happy,for a few days i felt very miserable distressed and listless with crying fits when this was over i felt very happy although there was no special reason
angry,out on a weekend with a group of people everybody felt irritated because at night the music didnt stop in time and at breakfast my boyfriend ran away because we didnt agree with him i felt angry
sad,recently i felt very sad without any reason it lasted for a few days there was nothing i liked in that period
happy,when my boyfriend and i experience something nice or when we have made a nice walk together
angry,someone told me that he would stay at my home for one night therefore i made big efforts to make everything ok food one day before he cancelled the appointment because he had to go to church with his parents
sad,we had to take our cat to the vet for mercy killing an injection
happy,one night i had a very good conversation with two friends i then realized how worthy they were for me and how happy i was to have them as friends
angry,when a very close friend with whom i have a very intimate and bodily relationship he had a girlfriend started to avoid me and didnt want to talk to me any more
sad,when a good friend with whom i had an intimate relationship made clear that he didnt want to continue in the same way he choose his girlfriend also a friend of mine
happy,my boyfriend suffered form ill health for some months this week the physician told him that he was restored to health
angry,i made an appointment with a friend to drink coffee togehter however for the third time in that week she arrived an hour too late
sad,my dear hamster called hannes died at the age of and years his shape forced me to mercy killing an injection
happy,after the funeral of an acquaintance i felt very depressed that feeling turned into joy when i heard that i had achieved a good grade for an examination
angry,when after having cleaned up the kitchen two hours later i saw that there was a big mess it irritated me very much
sad,one night i was called and told that the father of a close friend died when i visited my friend at home and when attending the funeral i felt very sad
happy,when i found out that the girl with whom i was in love loved me too
angry,when being made look a fool by the teacher in front of the class during a turn
sad,my mother unjustly became very angry with me and sent me to my room while my father explained that the way she saw things was not correct i had done things with the best intentions
happy,once a week i work as a volunteer in a biologic garden this work in the garden and the contact with other volunteers filled me with joy they also gave me support after i failed passing my drivers test
happy,when someone made me a compliment after an examination just at the moment i needed it it was amicable hearty and sincere
angry,a friend told me it would be better for me not to be on familiar terms with another friend although in my opinion he had no reason to say such things he only said so hoping that i would search support from him that however was not necessary
sad,i had a good relationship with two friends once without reason they clearly showed that they thought i was naive dull and unable to take care for myself while i expostulated that i could manage things
happy,a few days ago i hitchhiked to arnhems with a friend everything went well they picked us up very quickly the sun was shining i was feeling free and for the first time after long time happy i really had the feeling that i was living at full speed
angry,i had made an appointment with three friends we had to go out together when i arrived at the place the other persons werent there i became very angry because i thought they were gone without me that however didnt appear to be the case
sad,i finished the relationship with my boyfriend after having felt myself very unhappy for a long time
happy,a close relative of mine underwent a difficult operation and everything turned out fine
angry,a classmate urged me to carry out a particular protest along with him and when the time came this fellow drew back while i had to face the situation
sad,when i failed the entrance exam to imec
happy,when they told me that i had got a study grant
happy,when my father was saved from a severe work accident
angry,when i first saw a person begging
sad,when my basket ball team lost the qualification at a final
happy,when i got to know that i had passed the university entrance exam i thought that i had done one of the exams badly
angry,we hitch hiked our way back from a town rather drunk we were dropped in another town which was unknown to us i needed to urinate so i did it on a wall which turned out to belong to the military headquarters they arrested me and made me pay a fine of pts we had to go home on foot km since it was too late for anyone to give us a lift
sad,i was to meet a girl in a discotheque she was very pretty and i was very happy but she did not turn up thank god there were some other friends there and i was able to have a more or less good time
happy,the day some friends of mine and i decided to go to galicia on holiday
angry,at home when they lost three pieces of my puzzle
sad,when i had an argument with a friend
happy,a friend of mine told me that i had passed the entrance exam to the university
angry,my family told me to leave if i was not willing to accept the conditions they imposed on me
sad,a friend of mine called me when i was not at home i phoned her back to know what she wanted and she told me that she had dialled the wrong number
happy,when my brother was born
angry,once i saw some children hunting a cat to death
sad,the death of a friend
happy,when i saw that i had passed the university entrance exam it made me forget all my problems
angry,when i was told that a boy did not want to be my friend without any apparent reason
sad,when i learnt that a boy i liked had been with a girl for three years
happy,when i saw my year old sister at home after having waited for her all night not knowing where she was
angry,i had an argument with my mother because i criticized the rules she imposes at home which are too rigid and arbitrary for me
sad,when i learned that a friend of mine had not been speaking to her boyfriend for a week after an argument because of unfounded jealousy
happy,after several days delay in my girlfriends menstration i was very glad to see that the pregnancy test was negative
angry,i felt angry when i saw on tv the last slaughter of negroes in south africa
sad,when i saw the pictures of the draught in etiopia
happy,the day the real madrid team of basket ball qualified for the final at athens
angry,during a trivial friendly discussion one of the participants made an intervention which made me feel uncomfortable
sad,when i heard the last regulation of the socialist govrenment concerning pensions
happy,when i passed an important exam
angry,when my father addressed me directly and maliciously thus including me in the family war
sad,when my parents got divorced
happy,when i passed an exam which i had failed last year
angry,a murder
sad,when i failed two subjects last year
happy,when i was told that i could take a week off and go for a trip with my friends
angry,during an argument between friends one of them accused me of taking advantage of some other friends who usually come to the university in my car saying that i ask them too much money for the petrol
sad,when i learned that two of my friends had had a serious car accident
happy,when i saw that i had passed an exam it was the last chance and there was a lot at stake
angry,my cousins were playing at home and one of them broke a decorative object which was very precious to me
sad,all my friends arranged to go for an afternoon snack and they did not tell me they told me that they did not have my phone number but i do not think that this was true
happy,when i pass exams or when a close friend of mine recovered from an illnessetc
angry,during a family discussion on my future and my prospects as a student they accused me of not bothering about looking for a job to assume my financial situation
sad,depressions
happy,when i met a very close friend of mine after one year of separation
angry,an argument among several friends because of the irrational behavior of one of them who fell out with us for no reason and said that we were to blame
sad,a classmate died after being two months in coma after a car accident
happy,when my sister was born
angry,when i failed an exam unfairly
sad,when my grandmother died
happy,when my little sister was born
angry,when a professor of this faculty laughed at and was suspicious of a composition written by a classmate and me
sad,the death of a relative friend or someone i esteem
happy,when i passed an exam
angry,when i failed an exam i thought i would pass
sad,when my dog died
happy,i had not seen my brother for five years as he was not in spain when he arrived at the airport i felt great joy
angry,when i saw my brother being attacked and i could not do anything
sad,when a classmate died
happy,i got my driving licence after they had frightened me with its difficulty
angry,when i saw a man hitting a child of years without any consideration simply because the child had been leaning against a window
sad,a friend of mine who was driving a car ahead of me died in a car accident
happy,when i saw that the mark i had obtained in an exam was a good one
angry,when i was young i became very angry as i was not allowed to stay up all night for the fair in my town
sad,when summer is over and i have to leave the town where i spend my holidays
happy,when i learned after the ecography that my mother was expecting a baby girl that was what i wanted
angry,i had an exam and i had it well prepared i did the first part very well but did not know the second part
sad,when my parents did not let me go on a study tour
happy,an invitation to spend days at the seaside with all expenses paid
angry,when males in my family try to assign house duties exclusively with referance to sex
sad,i had a quarrell with my boyfriend and decided to finish with him and and my easter holidays
happy,when i passed the university entrance exam
angry,when they threw my holder down on the floor with all my notes for an exam inside it and they got all mixed up
sad,when my mother was operated
happy,my father had an operation which lasted for hours we were all very worried but it was successful
angry,an old woman was violently thrown down the stairs of the tube by a group of louts
sad,a child years old died in a stupid way he fell from a place which was metre high
happy,i was studying in the library and a classmate told me that she had obtained a grant to work in the library
angry,i learned that a classmate had given a list of peolpe who help each other in exams to the professor
sad,i phoned two friends and was not able to arrange a meeting with either of them so i had to change my plans
happy,the begining of my relations with my current girlfriend
angry,a typical family argument
sad,the disqualification of two of my mates in the military service
happy,when i pass an exam
angry,when you kill yourself with work and see the number of slakers wandering around doing nothing
sad,when someone in my family died
happy,i thought that i was going to fail a subject and so i began to study for the final exam then my friend told me that i had passed it that meant that i could go home as i do not study in my hometown
angry,i was living in a flat where things did not go very well for me finally they threw me out and this prejudiced people i esteem a lot
sad,when i read the diary of the girl with whom i was living it was about another boy with whom she had been going around some time back
happy,i met a girlfriend again after not seeing her for several months i saw her in a discotheque we do not like discotheques but we went there because we knew we would meet there
angry,i was angry when my sister began to talk nonsense and to laugh at the way i swept the room my anger grew i tried to control myself after telling her to leave me alone i vented my anger on her as she did not obey me
sad,my mother was working with a knife and we were all laughing heartily she was not able to control the knife and stuck it deep into her hand
happy,a friend of mine suggested that i become a film extra the idea seemed very funny to me and my reaction seemed rather outlandish to the others
angry,when i miss the train and i am late and i have to wait half an hour for the next one
sad,when i knew i had to go out with my mother on some errands
happy,when they phoned me from greatbritain to tell me that i could go there if i wished in summer
