happy,the weekend after i argued with my parents i went home again and they couldnt have been nicer as soon as i walked in mum kissed me then dad and thanked me for the birthday presents id left for him including a very sentimental birthday card
angry,my flatmate was asking questions about my relationship with my boyfriend whether i wasnt treating him as unfairly as i claimed hed been treating me as a result i was angered and became defensive
sad,a very close friend from victoria visited me over the holidays having enjoyed his company immensely over short days i was overwhelmed by sadness when he left to return to victoria
happy,joy of giving birth and of sharing that joy with my husband moments of complete happiness and feelings of so much love
angry,anger at doctors for their treatment of me after giving birth they left part of placenta behind and i bled heavily for twelve weeks due to this i felt weak and emotional and they said i needed psychiatric treatment and give me no support
sad,when my son was diagnosed as having cerebral palsy at age he would have to endure so much labelling stigma and discrimination even though his case was relatively mild
happy,receiving notification that i had made a successful application to the speech therapy course at uni gave me a very good feelig of achievment and joy
angry,my exboyfriend began to date my best friend after they had been seeing each other i found out that he had been sleeping with another girl without my friend knowing i told my friend what he had been doing behind her back
sad,my mother left my father for his best friend and he moved to papua new guinea despite the fact that i am closer to my father than to anyone else in my family i had to move in with my mother and say goodbye to my father not knowing when i would see him again
happy,seeing a close friend who had just returned from twelve months overseas
angry,after seeing an uncertain child work on a model for several hours i watched a bully of the same age destroy it telling the child that it was worthless
sad,leaving home to move closer to university as an oldest child this experience was traumatic for both my parents and myself
happy,when i finished my exams after th grade i was worried about getting a te score high enough for physiotherapy when i found that i had been accepted i was ecstatic or more appropriately could jump for joy
angry,when a socalled friend let me down when she promised to tell me when a certain concert was occurring and that shed get me tickets i was really looking forward to it she did nothing just told me out of the blue one day what a fantastic concert it was going to be
sad,when my family heard that my mothers cousin who lives in england wrote us to tell that he had cancer of the lymph glands
happy,two years ago somebody i like very much wanted to give up his studies i tried to make him understand the importance of what he was going to do not only of the difficulty to find a job but also because he will decrease his culture etc this person made the test to the college entrance examination and to our great joy we found out that he succeded in entering at the university
angry,one day in a crossroad somebody crashed my car i got out and this person laughed at me i felt such a great anger that i got in my car and went away
sad,i dont know why suddenly i thought that what i was feeling for my boyfriend was not really love after almost three years being together this matter of fact shaked me and i felt a great sorrow that i can call sadness
happy,when i entered at the university
angry,when one teacher unjustly gave me zero in a test saying that i was cribbing
sad,when my grandmother died
happy,when in the end of a semester i got the approval in a matter that i judged very difficult
angry,i went to the school library and asked for a book but the librarian told me that there wasnt such however when an other colleague asked for it she gave it to him
sad,some colleagues decided to go out on a saturday not inviting me to decide either the place nor the time
happy,the situation in which i felt happiest in my life was when i was with the person i love for the first time
angry,i feel anger when somebody forbids me to do something
sad,i felt sad when i was despised by another person
happy,when i got through the examination for my driver licence and when i finished i knew i had passed it
angry,when they changed my office to another room without my agreement
sad,i couldnt sleep and began to remind of my childhood we are many sisters and at that time we were spanked a lot and i dont know why i started to remind of the spanks they and i had had their shouts when this happened
happy,i was in ilha grande with a wonderful sun with wonderful people with a wonderful sea with a wonderful boy
angry,this feeling occurred to me when my colleague entered in gv university and i didnt
sad,when i applied for the college entrance examination to fuvest and i wasnt approved in the second fase
happy,i felt happy when my mother borrowed me the car in order to let me go out alone for the first time
angry,i felt anger when i had a fight with my father and he beated me my mother came to help me because i was beeing beated and he also beated my mother
sad,it happened when i lost two very intimate friends in a car accident
happy,always when i am well succeded
angry,i feel anger when things dont come out as i wish
sad,when i couldnt go for a trip with my friends in a holiday
happy,when there was a possibility of getting on better in professional life i valorized very much this aspect people showed me this possibility not the real fact even because until now
angry,when they denied a job to a person that i propsed giving political reasons that has nothing to do directly with the professional level
sad,during an informal talk with a friend when we talk about the life of another person a common friend that is in a situation of not being able to assume certain problems that he decided to solve that is she herself suggested the problems and decided to solve them but didnt get it until the moment
happy,when i got a wedding ring of diamond from the boy i loved
angry,when they stole my dark blue tennis
sad,when i became conscious that men dont wnat anything they dont have a goal they have sex but this isnt important
happy,when i met again a great friend and talked a little while with him when i see again another i miss
angry,i felt anger of a friend when she met a date and become nervous and pest as she always gets when she meets him
sad,when i knew almost the same day about two great friends of mine that had serious existential crisis and mainly when i notice that im in the same situation that they are but i didnt realize it
happy,when i entered university
angry,im crazy about football when my team lost a goal in the paulist championship and so it lost the classifications
sad,when my grandmother my second mother died
happy,when i met a girl and asked her for a date and she agreed i thought this girl would never like me this was an emotion of joy
angry,about the car sadness i felt anger the way i acted after negotiating it
sad,to buy a car and didnt like the business and the car
happy,i felt joy when i red my name in the list of the approved in the entrance college examination
angry,nearby the end of the year my wife and i were having a car ride when it appears another vehicle driven by a drunk driver and provokes an accident
happy,to have a friend who i didnt see for months and under the circumstances that i met him made me feel happy and perhaps because it has been one of the good things that i learned with this friend
angry,the fact that i hadnt been informed about something and i had the greatest trust in this person
sad,a friend of mine lent me his apartment for holidays and besides this he was a fine person months later i knew that he died tragically in a moto accident he was very young and i felt sad and couldnt believe it until today
happy,when after a long time of searching i got my first job
angry,when i used to go to my chief asking about any doubt about the job and he didnt care didnt answer me leaving me speaking alone
sad,when i knew that a person that i liked very much didnt react the way i would like to even that i knew about his feelings for me
happy,when a person that i like very much got near to me
angry,when a person is privileged in account of situations that are unjust and disloyal to colleagues and friends
sad,when i was betrayed by a friend and decided to stay apart form her
happy,i made the college entrance examinations for puc it was what i wanted more when the first list came out i got frustrated i wasnt in when the second list came out without hopes i started to read the newspaper and my name was thre i was in the bus and felt like crying so that everybody could hear me the cry was hold and became forever a mask in my life
angry,once in my work it happened a fight between the person in charge and me i got so angry and spoke out everything i felt at the moment
sad,i remember the day my father died i was years old and my sadness was so great that until today i remember everything about that day from the clothes i was wearing to the reactions of people the despair of my mother and brother it marked me a lot and was the greatest sadness i felt
happy,the day i received the key of my apartment and we could enter in it for my fianct and i had bought it yet in plans and it seemed to us that this was almost impossible to happen
angry,when my boss cut off my vacations saying that in that month it wouldnt be possible and after some time he let another girl take vacations that month the anger was because of the resentment resulting from our bad relationship
sad,my fiancts family was adopting a years old boy i felt myself close to him as i never felt before after some time his mother demanded the care of the kid and we were obliged to send him back
happy,it was when a friend took me to a place and gave me as a gift my astrologycal map with the explanations of a psychologist
angry,when my mother slapped me in the face i felt anger at that moment
sad,when i deeply felt that i could lose the person i love best because of my foolishness
happy,in a day when at work in school and relationships came out as i wanted and i was recognized in my work
angry,when i was robbed in a bus
sad,when i try to get closer at a person and she misinterpreted me
happy,i was travelling in the south of brasil near the end of the year i was well settled with friends at the evening of m somebody also with us took from his purse pints of all colours and the of us and other friends that were at the same beach painted each other and we went to the beach with champagne
angry,one day i lent my tennis i just had washed to my sister because she asked it i asked her not to soil it as i had just washed it next day i looked at the tennis and it was dirty with wax she could not have soiled it it was lack of consideration i felt very angry
sad,the second time i went to the entrance exam to vsp and didnt get approved
happy,a friend of mine that is abroad undertook recently an axam to enter on university in dallas and was approved
angry,in certain occasion i have a fight with my boyfriend during the fight i closed the door at his face he went away but came back next day
sad,last year when i took the college entrance examinations i failed the fuvest it was for me the most frustrating situation because i had studied all year long and only thought about this
happy,when i knew about my first job
angry,my mother in law slept in my bed
angry,in the last year of the high school we had a huge fight between my group and the graduation commission two students of my classroom because they accused us unjustly of a gossip about them
sad,when i was years old my father travelled very much for his work he passed three months away from home
happy,when i got a small present form a person i like very much
angry,when a boy tried to fool me so he would be ok trying to show me that he is a gook boy
sad,in the my boyfriend asked me to forget him as it would be easy
happy,when i saw my name in the newspaper and i knew that i entered at the university
angry,i loved a person and he went away it wasnt necessary that he left me to reach his goals
sad,a close friend travelled to another country when i knew that he would only come back after many years i felt very sad
happy,i had a friend who i didnt see for a long time we had a relationship from much union and interaction it was more that one year that i didnt see her she appeared in my home and we talked
angry,my mother was ill and asked me to prpare our lunch i went to do it and while i was working she stayed behind me telling what i had or not to do i asked her to stop meddling and to go to bed when i went to ask for help to my sister my mother said that i was proud that i asked for help only when i wanted and that i wasnt able to cook by myself
sad,when on christmas day my grandmother died i received the news when i was coming back from a party on the th at am
happy,when i got a record as a gift from a friend
angry,a girl entered in the division where i work and greeted everybody but not me
sad,a dear friend was removed from the division whre i work
happy,i wanted to go out to walk but i didnt know either where or with whom suddenly an invitation appeared
angry,when my chief accused me of an error that i hadnt made
sad,when i knew about my sisters in law finacial situation and what she was facing
happy,i felt a great joy when i knew that my father was going to sell the apartment from guarusa because in some way we were helded by it that means that we didnt go to any other place because we had the apartment
angry,i dont use to lie to my parets about what i do and the two times that i felt anger were when they doubted me i said that i was going to the club and they didnt believe me because the day before they had met me at fliperama i had the wish to kill them
sad,i felt very sad when i saw the first list from the names of the people who entered at the university and my name wasnt there
happy,when i discovered that i and my friend would be licensed at the first call this emotion was accompanied by a great relief it was the coronation of a year of sacrifice and extrene discipline
angry,when i was misleaded by a person who assured that something would not occur that i had no reason to prepccupy myself and suddenly i saw myself implicated by the fact because of the incompetence and irresponsibility of that person
sad,when i didnt succeed to enter at the university i felt that the college entrance course sistem prejudiced me that my integrity and effort werent corresponded
happy,i felt joy when i entered at the university
angry,i felt anger when i saw that i was being misleaded by my boyfriend he went out with other girls i felt anger for his falsity
sad,when my boyfriend was changing his behavior there was something wrong i felt sad because its desagreable when a relationship is ending
happy,a meeting with the family and the friends i felt dear and loved sharing the gladness of being together at a birthday
angry,when my sister took something that belonged to me without my permission
sad,when i felt alone and without love
happy,after making an effort to enter at university i found a course and a school of higher education which were compatible with my experience and potentiality
angry,when i realized that the person i was courting hadnt been really by my side for a long time already he had deceived me and i let him deceive me
sad,when i noticed that i do many things to the pregiudice of myself
happy,i felt joy when i passed the worst phase in my life and discovered how many people considered me important to them
angry,i felt much anger and perhaps i feel it till now against my girlfriends sister who incited her to betray me just when i needed her very much she didnt think of anything simply passed over everything
sad,when my dog died
happy,i didnt like my former fob and felt joy when i received a telegram offering me a new one that i though better and for which i had been waiting
angry,without the employers knowledge and even without any communication their bank accounts were changed and their personal accounts closed
sad,my brother wanted me to buy a flute with him but i didnt accept afterwards i regretted it because he became sad
happy,the day that my boyfriend appeared at home with a pair of rings for our wedding
angry,a exboyfriend tried to prejudice me before my fianct and his family saying things about me that let his family worried we had to postpone our wedding and we were already using our wedding rings to be honest i didnt feel just anger i felt hate
sad,the day that the results of the college entrance examinations for the s paulo university were published and i didnt find my name on the list entering this university was my greatest wish and the fact of not having succeded caused a great frustration and not only sadness
happy,when people remember us and shows interest about what we do
angry,when my brother went out with my new shirt that i adored and returned it dirty with grease
sad,i felt sadness when i notice that im not important for a determinate person we do many things for a friend and we see soon after that he doesnt do anything for us nor thinks of us
happy,i felt glad to live again when i went to a meeting about the knowledge there are techniques of meditation that connect you with the essence of the human being
angry,my grandmother is a highly authoritative person who lives alone is independent but doesnt know to live without commanding the others i hate this
sad,i am always sad when my boyfriend goes away he lives and studies in an other city we have gone steady for and years and everything is going very well but sometime this situation makes me feel bad and very lonely
happy,when i bought my car
angry,when i had a serious argument with a dear person
sad,one night a very dear person said i hate you of course it was an impulse and this person didnt feel that about me the person expressed regret and everything was settled but i cant forget
happy,the birth of my daughter
angry,discussion with my mother about the way to educate my children i felt anger against my mother
sad,when my grandmother died
happy,i found a human treasure that i desired and got immediately i didnt think about anything when i touched him i imploded but i am whole
angry,and she said absurd things false things that filled my ears and inflated my head which seemed to be caught in a carcass where the heart wanted to explode and where the arm wanted to knock down the world
sad,one day i heard from a friend that the boy i loved had gone out with her and not with me
happy,one of the greatest joiy was when i succeded in acquiring a motorcycle through my own efforts
angry,i felt much anger when my fahter interferred in my relations with another person whom i liked very much ending something that i adored
sad,one of the greatest sadness was when my grandfather died because i loved him very much
happy,when i got a stereo walkman from my father when he had finacial difficulties i thought that although he promised to give me that present he was not obliged to do so
angry,when a colleague was rude with me because she didnt understand the subject about which i was discussing
sad,for not having succeded in getting the job as a translator that i wanted
happy,when i passed the whole weekend with my boyfriend coming back home on sunday afternoon he met my parents for the first time
angry,i felt anger against a person who told bad things about me in my absence
sad,after a disagreement between my parents when i was alone with my father and my sister the aggression continued when my father tried to put me and my sister against my mother revealing facts that had happened in the past like a talk between my father and his mother in law where she told him that my mother was not quite save
happy,i was in the living room at home with an exboyfriend it was nearly a year that we had separated during the talk he began to remember our courting and gave me a long kiss
angry,i was on a farm with a few friends and during the talk i discovered that a friend of mine was being betrayed by her boyfriend and a rd friend of ours
sad,i was watching television it was about midnight when a very dear friend called saying that his father had died in an accident
happy,always when i meet the person i love
angry,when i left after the examination to enter the university and even though i had studied the whole year i made a bad exam
sad,when i thought for an instant that a very good relationship with a person had finished
happy,when i entered in the university after a year of struggles
angry,in the university we were convoked to a stroll like a freshman i was still innocent about the manipulation on seeing the goal of the exaltation to poor character people i felt anger on feeling myself mass of maneuver
sad,in a social situation i became interested in a woman we talked we laughed we enjoyed each other she desappeared for a few minutes and a little after appeared with an other man
happy,a friend of mine travelled very far i miss her but feel joy too because fer life is taking the right direction as she wants so i feel joy for her mainly
happy,when i met my mother after months of absence
angry,discussing with a certain person about a job i was getting and that perosn was negative and pessimistic
sad,when i felt lack of aid from close friends
happy,i got a present from a great friend a dog
angry,i was waiting to receive the participation on the profits and did not receive it
sad,i didnt get the job i wanted
happy,when i can see my parents because now i am far from them
angry,once during a performance i did not sing the way i had to
sad,when i got separated from the woman i loved
happy,when i was admitted to the bulgarian state conservatoire
angry,i was angry when my abilities of a singer were underestimated
sad,i feel sadness from the fact that i was not born with a better appearance
happy,i have a new born child
angry,at a certain situation i felt myself neglected and undeservedly harmed
sad,the sudden death of one of my parents
sad,getting separated from my family for a week caused me a sense of sadness
happy,i felt joy most strongly some years ago when i took part in a nh competition and i was the first
angry,i feel anger when i see a parent beating and punishing his child in the street recently i was a withness of a similar case
sad,i feel sadness when i only imagine that i could lose a close person some time ago i lost a man whom ai greatly respected
happy,when my nephew was born the birth was hard it was a big baby
angry,my brother accused me undeservedly before my parents i was not guilty he was misled by his wife
sad,when i left my boyfriend i found another girl at his home but he did nothing to relieve the situation
happy,some time ago i was present at the wedding party of two close friends of mine
angry,someone stole my ski at vitosha and of course i was the one to be blamed i left them without supervision
sad,i got separated form my closest friend he went to work abroad
happy,an encounter with a man whom i love after a very long separation
angry,a shopassistant behaved rather roughly with me though she hadnt the slightest grounds for it
sad,i saw a friend of mine who had suffered a very heavy contusion after an accident
happy,at a success of mine at a real achievement
happy,for the first time in my life telling someone i loved them
angry,when my mother decided to clean out my room and throw out what she thought was junk without my knowing about it so i returned home to find half my stuff gone
sad,when i couldnt find my dog which was missing
happy,when i met my boyfriend and we discovered that we shared the same ideals and goals in life and that we could share all our feelings and thoughts and felt that the worlds not so bad when you have someone really close to share your life with
happy,when i passed the driving test after three failures
angry,when playing a football match there was one player who made mean tackels kicked at everything and did things having nothing to do with football
sad,a close friend decided to stop with his study and to go back home
happy,for instance when a girl is interested in me and likes me
happy,i sensed this feeling when i passed successfully the second tour of a competition
angry,i felt anger against a colleague of mine during a rehearsal in acting he hadnt learnt the text of an opera act in the course of several months and thus making difficulties for the rest of my colleagues
sad,i felt sadness when i had to get separated from the woman i loved who had to leave for her motherland
happy,i was happy when at difficult times i could find support in my friend and my fianct i was happy because of their spiritual and moral help which gave me new power to struggle i was happy then i felt it in my soul
angry,i felt it on the same occasion when i felt sadness which finally grew into anger
sad,my living and working conditions at home were unbearable we used to live in a three room flat together with two more families the discords caused a change one of the families moved out the other family stayed with us but i drifted away from my fianct in fact we were two families in the flat then i found myself alone in the struggle for this life because my fianct did not stay next to me my grief and sorrow took on large proportions i wanted to commit suicide but instead i threw myself against the cause of the irritation
happy,that was what i felt when i was finally accepted in the bulgarian conservatorie after i had applied a couple of years
