happy,during the period of falling in love each time that we met and especially when we had not met for a long time
angry,when i was driving home after several days of hard work there was a motorist ahead of me who was driving at kmhour and refused despite his low speeed to let me overtake
sad,when i lost the person who meant the most to me
happy,when i got a letter offering me the summer job that i had applied for
angry,when i was talking to him at a party for the first time in a long while and a friend came and interrupted us and he left
sad,when my friends did not ask me to go to a new years party with them
happy,on days when i feel close to my partner and other friends when i feel at peace with myself and also experience a close contact with people whom i regard greatly
angry,when i had been obviously unjustly treated and had no possibility of elucidating this
sad,when i think about the short time that we live and relate it to the periods of my life when i think that i did not use this short time
happy,after my girlfriend had taken her exam we went to her parents place
angry,when a car is overtaking another and i am forced to drive off the road
sad,when i recently thought about the hard work it takes to study and how one wants to try something else when i read a theoretical book in english that i did not understand
happy,when i pass an examination which i did not think i did well
angry,when one is unjustly accused of something one has not done
sad,when ones studies seem hopelessly difficult and uninteresting
happy,passing an exam i did not expect to pass
angry,friends who torture animals
sad,same as in anger
happy,when i had my children
angry,when my partner was attacked and lost three teeth
sad,when i see children on tv from areas devastated by drought and war
happy,when my child was born
angry,unjust accusations directed at me and my way of acting by someone close to me
sad,failing an examination
happy,when i saw a person i had not seen for a long time
angry,when i heard on the radio that the football match in belgium had ended in a catastrophe and several people had died i could not understand how normal people could behave in such a way
sad,when i feel lonely perhaps because i have to study a lot and i am shut up in my appartment nothing happens in particular because there is no time for anything else
happy,when i was accepted for a course on finance and accounting
angry,at my summer job nobody looked after me in particular and i had to learn all on my own
sad,when i was not accepted as a student in finance and accounting
happy,passed an exam by points
angry,when i spoke to janerik wikstrm on the telephone
sad,railway station goodbye
happy,i passed an exam that i was absolutely certain that i had failed
angry,i locked myself out
sad,i missed the last tram home and had to walk in the pouring rain
happy,when i won a trip to greece in a competition
angry,at work when an elderly man complained unjustifiably about me and distrusted me
sad,when i had not understood anything after a lecture
happy,at a friends birthday party with some of my closest friends it was all very pleasant and one could say that i was happy to have such good friends
angry,mad at my dad
sad,a case of unrequited love
happy,i felt very happy when i won the football pools
angry,when someone stole my bike
sad,when i saw the list of books to read for an acccouting course i thought oh god how will i ever manaage it
happy,when the whole family gets together for a one week holiday everybody feels free and the trip is well planned it works out well and we enjoy ourselves
angry,when friends try to put me down or hurt me
sad,marriage crises boredom
happy,when i passed the first examination that i had to repeat
angry,when my boyfriend went away for a month long holiday without me
sad,last year when i worked during the summer holidays and studied at the same time for an examination i had to repeat my boyfriend went to greece for a holiday for a month
happy,the day i was told that i had been accepted as a student of economics
angry,at a restaurant i observed how the gypsies tried to get money by cheating the foreigners ie non swedish speaking my anger had nothing to do with hatred against foreigners but it was an expression of the anger i feel when i see people being used
sad,at the begining of a new course one is afraid of encountering problems one can not manage thoughts revolve around failing the subject and the consequences it would have for the future
happy,when i found out that i had passed the last two exams by a margin of three marks
angry,when i got caught in the pouring rain last thursday and did not have a raincoat on me
sad,when i failed an exam
happy,when i gave birth to my son and saw that he was alive and that i had managed it well he was born a month too early with a malfunctioning lung this happened a year ago
angry,when a colleague asked me for help at work despite the fact that he had more time to do it than i had
sad,when i did not get the salary increase that i had been expecting and understood how little ones work was appreciated
happy,new years eve i met my girlfriend we stood on the steps outside her parents home and i kissed her for the first time
angry,the editor changed the heading of an article that i had written he considered the heading to be derogatory towards the person i had written about
sad,a close acquaintance of the family died of lung cancer although it was expected i still felt depressed
happy,when i got the loan for my studies
angry,on the tv i saw a news feature on south africa a policeman attacked a group of black people with a whip
sad,the thought of having to read a boring book of pages in english
happy,when my sister after a history of one abortion and one stillbirth gave birth to a perfectly healty boy
angry,we were starting a student project and the teacher we talked to was very negative and not very helpful
sad,when my boyfriend openly let me down preferring another girl
happy,unexpected visit by a close friend whom i hadnt seen for half a year
angry,being treated unfairly
sad,breaking up with a girl
happy,when i was accepted as a student at the college not having thought it possible
angry,i was accused of having done something which i hadnt and got very angry
sad,when my grandmother died
happy,a couple of years ago during the summer holiday i was fishing at a lake with my husband suddenly it started raining while the sun was still shining i experienced a feeling of joy happiness and fulfillment the whole nature was full of music
angry,i went to a lecture and once again it had been cancelled this was the second time one had a negative attitude towards the lecturer
sad,i heard that a former superior of mine had died i was later at home home reading about it in the newspaper and i thought of our interaction and how it was no longer possible the limited scope of human life is sad
happy,i had a summer job in sweden and my boyfriend came to meet me on my birthday
angry,in the holiday cottage of our association two of my pals came to wake me up early one morning by bringing a radio played at the highest volume into my room it was the morning service at its loudest
sad,my grandmother died suddenly last summer
happy,i was told quite unexpectedly that one wanted me to become the vicechairman of our student organisation i was really surprised and joy was the first emotion i felt though behind it there was worry how shall i succeed
angry,we were in a disco and the evening was not at all pleasant despite my not knowing why i was angry with my companion i let him feel my bad humour as i cannot hide my feelings
sad,my grandmother died and my mother called me one sunday morning in the autumn the way my mother told me about it i hated her at that moment she sounded as if she had been waiting for the death of my grandmother i had lost a person close to me i felt guilty too as i had been bad to my grandmother of late i had not remained calm when she no longer understood everything so well
happy,last night i had a chat with a fellow student i had known her for about half a year and for the first time we were speaking the same language meaning an inspiring discussion and encounter
angry,i sometimes quarrel with my mother because she blames me though i have not in any way been connected to some events
sad,after hearing about the death of my grandfather first i could not believe it but later i wept and felt the situation was hopeless i felt lonely and wanted to be consolated
happy,i met a dear friend of mine after a long time i expressed my feelings in our own usual way by mutual scolding and abusing with complete understanding and by touching patting and taking the hand of the other person etc
angry,two boys whom i know were telling me in an indecent manner how they had teased a young and shy girl i know they had despised her conviction scorned and touched her i got very angry and did not try to conceal it and gave it back to them
sad,my sweetheart left me or rather we decided to break it off by mutual consent the consequences were unrestrained weeping feelings of loneliness hopelessness and disconsolation i felt that i should find a friend to talk to joyfully and to forget
happy,when i won a tennis match
angry,when my tennis match was interrupted because a kid cycled right into the court
sad,no response
happy,celebrations on the graduation day with the orchestra playing in the garden i am a part of this orchestra
angry,i had a very heavy work load and two colleagues whom i have nothing against disturbed me by terror ringing ie continously interrupting me by telephoning
sad,after an exam which i failed
happy,when i met an old schhol friend school love who works in skvde
angry,when i was deputy manager during the summer certain deputies took liberties more than what was normal
sad,when i realized that my girlfriend whom i like and i were going to separate
happy,passed the last exam
angry,i reached the bus stop and realized that i had forgotten my bus pass
sad,my current work load is too much the feeling comes back from time to time
happy,when my one year old son gives me a spontaneous kiss
angry,when someone does something wrong which affects me negatively
sad,when i think about my parents getting old
happy,an excolleague asked me if i was interested in working in their accounts bureau they needed clever people and he had immediately thought of me
angry,i saw a report on tv news on apartheid in south africa
sad,no response
happy,when my girlfriend became pregnant
angry,the time when someone let the air out of the tyres of my cycle
sad,when i read a lot and did not remember anything
happy,no response
angry,no response
sad,long illness
happy,when i passed an exam
angry,when i missed the tram after having run for it
sad,the inability to read a book at college
happy,i worked at a lawyers office during summer and i got a very good reference from him
angry,when i am accused of something i have not done i get unbelievably angry
sad,when i began to read a thick book which i had a limited time to read also when i have a lot of work to do and i cannot keep up
happy,when i was finally qualified for my profession
angry,someone drove into my car and then denied that it had happened
sad,when i was told that my friends wife had cancer
happy,i stopped working had a boring job
angry,quarrel in the family
sad,when i am alone in a room with no contact with anyone loneliness drains me
happy,when i get a hug from someone i love
angry,my car had been towed away by the traffic police because it had been wrongly parked however the sign had been put up only after i had already parked
sad,after an operation i had to stay in bed for a long time
happy,when i won an unexpected sum of money
angry,a colleague asked me for some advice and as he did not have enough confidence in me he asked a third person
sad,i wanted to be pregnant and did not succeed so i was depressed at every menstruation
happy,when i was at a party i met an old friend from an adult education course we had not met for years but had both thought a lot about each other a wonderful experience
angry,when close relatives tried to dissuade me from studying psychology because of its low status
sad,i had a long discussion on politics with an acquaintance he was more knowledgeable than me and i failed to explain my point of view and was misunderstood so i felt depressed and left
happy,when i recently got an appartment in central gottenburg
angry,my employer took too many aspirins for a bad back and also drank an enormous amount of spirit this was dangerous and he did not understand that he had done anything wrong
sad,when i left new york and all my family and my friends behind me
happy,when my son returned from mountaineering healthy in body and soul
angry,the sports fishermen who catch gulls instead of fish with their hooks it is often a mistake but it makes me angry
sad,i feel sad about an event i can not influence
happy,when i was informed that i had been accepted as a student of psychology
angry,when i found out that the guy i was dating at a particular time had a steady relationship going on with someone else for a long time
sad,i felt sad and depressed when i heard that our cat had died
happy,when i was acceptted as a student of psychology
angry,when after a week at school a teacher sent a note home saying that my son was inattentive and unable to do his lessons
sad,when i thought that it was going to be impossible for me to start studying due to wrong information from the student advisor
happy,when my son was born
angry,when i was pointed out as a problem child in primary school and my mother took the teachers point of view
sad,when i was accused of neglecting work for the wrong reasons
happy,when after months of national service i was downgraded and did not have to do the remaining months
angry,when my parents drove me to a nearby place and went home immediately instead of waiting a few hours they could have easily waited
sad,when my exgirlfriend and i discovered that there was a certain risk of her being pregnant
happy,when my older sister told us that she was thinking of joining the rest of the family for the winter sports holiday
angry,when we were in high school a few guys sometimes provoked a friend of mine they called her a pig and then grunted this irritated most of the girls once one of the girls got angry at my friend and said something nasty and this made me terribly angry
sad,i talked to my boyfriend on the phone when i was in high spirits and had a lot to tell him i had been looking forward to this conversation and he did not listen to me to the extent that i had anticipated
happy,when i got through the first day here at the department
angry,when my boyfriend sat up half the night playing computer games with a friend
sad,when i had to leave my mother and my sister after a weeks visit
happy,when i was asked to be a childs godmother
angry,when my mother interfered in my life
sad,when i was left alone one weekend without being prepared for it
happy,when my husband suddenly came to see me at my new job and brought some flowers and cake with him
angry,when my father asked me if i was a communist at the same time he made it clear that i should no longer see myself as his daughter
sad,when i applied for a job which i thought i had a good chance of getting i was not even granted an interview and did not get the job
happy,when we were able to afford a new sofa a leather one which cost sek i had waited for it for years
angry,when my boss enrolled in a course to satisfy his own ends to trample on his associates i have the misfortune to have one of my superiors in my course
sad,when i argue with my mother about the way she treats her two children differently
happy,when i recently managed to get my first consulting assignment myself ie on my own initiative
angry,when my friend as usual forgot the tickets at home for a performance we missed it
sad,the elections of and the thought of what a social democrat and communist majority could achieve especially worker share funds and its extension
happy,when i was appointed to position of trust in a group set up to change the working environment
angry,when i tried to explain to a plumber face to face that the toilet was broken and he did not believe it it had been mended ten times
sad,when the result of a project work was treated nonchalantly intead of being criticized by the teacher
happy,after my girl and i talked things over our relationship changed and became positive a diificult time turned into pleasant one
angry,when i read about reagans tactical decision concerning the south african boycott
sad,when my half brother became seriously ill with cancer and died later
happy,when i was offered a high position of trust which i later accepted
angry,some noisy guests arrived at the hotel i had been slightly irritated earlier at night when i was trying to sleep they were having a party so i went and yelled at them i wanted to sleep as i had to get up early the next day
sad,when i was told that i had not been successful in getting the job i had been expecting i was sure that i was sufficiently qualified
happy,cycling in the spring sunshine gives me such delight happiness is to be healthy my wonderful finance simply being here on earth
angry,recently when my sister who is four years younger than me and very spoiled shouted at my mother for no apparent reason the heartbroken expression on my mothers face made me feel very angry
sad,when i watched the tv programme called the living planet and saw the far reaching environmental destruction caused by man
happy,on a boat trip to denmark of us had a lot of fun and we spent sek each on one armed bandits and against all odds we won the jackpot of sek
angry,on the way home from marstrand i was driving behind my fathers car another car tried to push in front of my father and he was forced to swerve and he thus collided the car with a pillar the other car drove off without even seeing what had happened
sad,my girlfriend who had spent months abroad broke off our relationship by letter
happy,when i was at the endofterm party last week and had fun was happy and sang and drank only soft drinks it is possible to have a good time without alcohol
angry,in a course i thought that i deserved good marks but i only got ordinary marks with no justification as to why i was given these marks
sad,when i crashed my car and it had to be scrapped then it was my fault and i feel depressed as i miss the car
happy,when i felt that my love was returned
angry,when it became clear that a man had used many people sexually and psychologically despite the fact that many people looked up to him i understood that one could not trust him and i was forced to hide this for a while
sad,when i feel helpless after having tried to help someone without any result
happy,when i recently got a very positive answer from a clinic telling me that they would willingly assist and collect data for me for a clinical pilot study
angry,when after a lot of provocation my child threw a plate on the floor
sad,when i realized that i could not communicate properly with my closest friend
happy,when i began dansing the teacher came and told me that i was very good and would soon get into the ballet academy
angry,when i was forced to call the telephone company about a bill concerning a disconnected phone belonging to my landlord the bill was four months overdue and in the meanwhile he had been using my phone he seemed to have no intention of having his own phone reconnected
sad,whenever i read or think about the way people treat animals and nature
happy,when my month old son is happy and well
angry,after an examine i had been satisfied with
sad,when a colleague failed to contact me at the arranged time
happy,when i gave birth to a healthy boy
angry,jealous of my husbands old girlfriend we met her with her husband and there was a lot of reminiscing
sad,when my daughter had problems with her friends and i could see her predicament from the window she was given a the cold shoulder
happy,when my husband and i decided to take a few days holiday after a particularly trying period
angry,exchange of points of view with my sister on a family matter
sad,treatment to become pregnant with a negative result
happy,when i gave birth to a child and saw that it was normal when it was put against my breast
angry,at a cash desk where i had gone to buy rolls of kitchen paper at a reduced price after queuing with screaming children it turned out that i had taken two roll packets instead of the one roll packet to which the rebate applied the assistant said you will have to get it another time
sad,when i first heard that tage dannielsson had died
happy,the high school entrance exam
angry,an unjust refree decision at a sports event when i was the team leader
sad,when my girlfriend left me
happy,yesterday when the final whistle blew at the final match between ois and ifk and it was certain that ois had won the swedish title
angry,a drummer who had borrowed my drums destroyed both the drumskin and the sticks he did not repair them nor did he tell me about it
sad,when my dad gives priority to my kid brothers band and his other activities we both play in different bands and rehearse in my parents garage
happy,when i dived among sharks and the brightly coloured fish on the outer reef of tvavni fidgi
angry,when i told off a computer teacher who did not want to teach me beacause of prejudice
sad,when i could not do anything because of a bad back
happy,when i passed the driving test three weeks ago and got my licence
angry,no response
sad,no response
happy,when i met friends i had not seen for the last years
angry,no response
sad,no reponse
happy,no response
angry,when the morning newspaper has not arrived
sad,no response
happy,i feel unbelievably happy about the relationship between my boyfriend and me it is a reoccurring feeling
angry,when i argue with my boyfriend i feel as though he feels superior to me
sad,when i failed an exam last summer i had worked very hard for it and i was very disappointed thinking that it was hopeless to continue at college i did overreact
happy,i was very happy when i got an attractive summer job
happy,the birth of my child
angry,when during winter the water pipes froze and we did not have any water for two days
sad,i did not quite succeed in breast feeding my baby
happy,during the christmas holidays i met some of my old friends after not having seen them for six months
angry,when our religion teacher presented shocking sectarian thoughts and dooms day as official teaching
sad,my grandfather died when i was an exchange student in the usa
happy,in the undergrounds escalator a youngish bum asked me for money although i did not give him anything the fellow told me that i was really goodlooking a man who was in front of me also turned to look at me
angry,in the student kitchen that we share somebody drank from my juice pot one litre so that i only got one glass out of the whole pot
sad,my father gave money to my brother but not to me
angry,i missed the train and had to wait for the next for two hours for this reason i missed an appointment which had been very important for me
sad,when my grandmother died i had lived with her for ten years
happy,a person with whom i had been on bad terms gave me a present we became reconciled
angry,i was watching tv with a friend after the first film i wanted to watch another film on the same channel my friend switched over to the other cannel without asking me what i wanted
sad,my boyfriend an i seperated on his initiative
happy,after having considered it for hours i was able to overcome my scruples and to call a friend with whom i had fallen in love i realized that my decision was right and was very glad
angry,i moved to a flat a friend who had lived there before had left the flat in a terrible mess i was very angry about that sloppiness and impudence
sad,my father had a complicated operation a long time before and also a long time after that we did not know how he would get over it during all that time i felt very sad
happy,in summer when i was sailing with friends in greece i felt joy
happy,walking along the beach with a friend another girl talking picking up shells laughing chasing seagulls
angry,a friend suggested in a roundabout way that the reason we were late for something was because of me and that im often late i know this was partly true but felt it unjustified that particular time and i felt i couldnt do anything about it anyway ie being late
sad,talking to a very good friend who had just had a very bad experience which was changing his whole way of looking at life etc
happy,on meeting an old friend of mine
angry,during a fight with my best friend
sad,when my dog died
happy,when i realised that i was forgiven by the god who is there when i realised how much god loves me and that my acceptance with him is not based on my performance that he loves me unconditionally and showed that love in christ who died because i do need forgiveness
angry,at my fathers treatment of my mother at his disregard for her and not being committed to her
sad,at a lack of love of my father for my mum sadness for him more than anyone else because he does not realise how much love and happiness there could be between them and is and how much he is damaging himself apart from mum
angry,i told my boy friend not to park in a certain place because the car would ger towed away he didnt listen and it was towed away at that stage our finances were below the poverty line it cost us all the money we had to get us through that week including rent
sad,my sister won a scholarship to norway and it was particularly as she walked across the tarmac to get on the plane and she looked back at us
