happy,when seeing a friend that i had not seen in a long while
angry,i felt anger at my roommate due to his habit of leaving dirty dishes in the sink and generally not cleaning after himself
sad,when my grandmother after staying with us for awhile went back home
happy,achieving my goal at a swim meet i worked toward the goal for yrs i was capable of achieving it but i didnt know when
angry,going to cowell hospital and finding out tediously that i had a stress fracture the anger came when the senile doctors found out weeks later that i had stress fractures in one foot and should have had crutches i was in distinct pain and barely could walk to classes they said it would be better in weeks
sad,losing my job that i had for summers i took it personally and cried for hours off and on i wanted to hide away and did for a few days
happy,it was the weekend of my homecoming i saw my sister for the first time in months shes my best friend and extremely close
angry,when i found out my cousin had been killed i was angry at the world and her murderer who was her exboyfriend it was the worst and most hateful day of my life
sad,i spent a weekend in san diego visiting my boyfriend rob we were at the airport and my plane was just about so leave after saying goodbye i boarded the plane it was the hardest thing to do and it was a sad trip home
happy,i got an a in anatomy the first one i have ever gotten in a science class here
angry,i caught a peeping tom at my window when i was getting undressed
sad,saying goodbye at the airport to my boyfriend who has to go to school back east we are very close and have been together years
happy,went to a movie with a date walked on the beach in alameda spent some time afterwards in her apt
angry,i am currently taking cs p i had to finish a couple of assignments but i was hindered because i could not get a passing score on my program
sad,the girl i was seeing didnt want to have a serious relationship
happy,i asked someone to go out and she accepted right away
angry,during a dance someone slashed my tires and dumped paint on my car i had four other friends with me that i drove and furthermore it was raining
sad,when i was trying for a girl who i really liked and cared for and thought she felt the same way too but she didnt like the idea and just wanted to stay friends
happy,finished a difficult midterm
angry,i was called racial slurs behind my back
sad,my grandmother died during christmas break several years ago
happy,did very very well on a physics midterm
angry,a friend doesnt let me study when i want to she doesnt feel i need to study and doesnt understand how important studying is to me i get very angry with her
sad,death of a pet rabbit we had to give it away because my brother became allergic to it we gave it to a man who kept animals and lots of other animals for children to watch we went to visit our rabbit it was badly beaten by the other rabbits and eventually died
happy,when i won my car
angry,i came home one day and discovered that my sister had borrowed my car and had gotten into an accident with it my entire front bumper was destroyed
sad,when i heard the news that my grandfather had died
happy,at a party in which i met an interesting female we enjoyed eachothers company while slow dacing
angry,i live with my sister now and sometimes she angers me especially when she thinks i dont keep the apt clean enough
sad,when i found out that i could not go to the concert after buying the tickets because of a biology test which occurred the morning after
happy,last year my freshman yr it was a day in march i did well on some tests i seemed to finally adjust to college it was hot and sunny i was walking in front of a frat when i heard beach boys surfinusa i had this overwhelming feeling that to be at cal was good i still have it somewhat
angry,last semester when i dated a girl whom ive known for almost a year however one night she said she wanted us to be just friends i confided this to a friend jim i was really suffering a month or two later he broke up with his old girlfriend and they started going out regularly i have no girlfriend nor have i had a romantic relationship of any significance i feel some anger but we are friends again
sad,when i was a sr in hs one of the class counselors died of hepatitis she was very sensitive she knew my shyness and drew me out to improve myself image i missed her funeral so i could not publically grieve my parents didnt understand
happy,someone a boy paid special attention to me
angry,my roommate leaving my drawers in a mess after plowing thourgh them looking for something
sad,my friend who was in the bago was kicked out of the sorority
happy,my last genetices midterm a decent grade
angry,when someone threw a firecracker into my room at am in the morning
sad,a close friend of the family died
happy,i received an unexpected b on an engineering midterm i did not study nearly as much as i should have and it was a difficult test
angry,i was supposed to meet my girlfriend at a prearranged place but it took me an hour to find her
sad,my grandmother died over the summer i knew her very well she baked great biscuits she was in the hospital but expected to improve and go home soon she died in her sleep
happy,finding out my grades at the end of my freshman year
angry,when i found out that my good friend and roommate did not pay the phone bill and electric bill like he promised and let me down
sad,when i found out that my girlfriend would not be coming back to ucb for one semester but would be living in san jose
happy,going to chico to visit a friend
angry,when the person im having the affair with wont talk to me in public
sad,my roommates sister committed suicide
happy,when fell in love with my present girlfriend
angry,when people would tell me that my exgirlfriend was playing around on me
sad,when my grandmother passed away
happy,i got a very good grade on one of my midterms a few weeks ago
angry,my peers didnt want me to meet someone during rush for fear that i would give her a bad outlook on our sororoty house i shouldnt have seen this but they blew and i did
sad,i was told that a friend of a friend committed suicide
happy,when i had achieved a goal indirectly i work for cal football and our nd win of the season was very gratifying and brought our joy because of the hard work involved and the fact that no one expected we would win
angry,i had worked long and hard on a project when a friend inadvertantly destroyed it i could not forgive him for a long time and at times still get angry at him
sad,when a pet died the pet was the closest friend i had for years
happy,getting my accentance letter from cal
angry,i went out dancing and found my boyfriend kissing another girl
sad,at the end of my senior yr in high school i found out that a friend of mine i knew had cancer had been diagnosed as terminally ill
happy,today i did a lot better on my architecture project than i expected
angry,this summer i got into a fight with one of our patrons at a theatre he hit me and i hit him and her friend he hit my friend and we all hit eachother
sad,this monday i took a math bs test and flunked for the second time
happy,when i received a letter of acceptance to cal
angry,when someone told a secret i told them not to tell
sad,when my mother was very sick and almost died
happy,i gave my mom a gift she wanted for years i raflected her joy
angry,after a long trip in my dads van without incident i stopped to fill the tank with gas and dented the side of the van against the pole then my cars electrical system would not work when i tried to drive home from his house
sad,at one point in a relationship my boyfriend was seeing an old flame more than me at our confrontation tears were shed
happy,when i finally got a job after days of wondering whether i would be hired or not and counting on the money that it would bring
angry,a time when as part of my work i was sent out actually sort of volunteered to run an errand for someone who had no authority to send me out and the address was very far especially on foot and turned out to be incorrect too the whole trip was a waste
sad,when my boyfriend said he did not want to see me anymore which turned out to be untrue
happy,yesterday when i received a b on a history midterm i felt overjoyed after having received cs previously
angry,a month ago when one of my fellow workers got a promotion over me it was just a small promotion but recognition was involved
sad,when another fellow worker decided to leave the company we had been very close and we would not be able to work with eachother any longer
happy,when i drove partially across the country with my father we stopped in a few towns and stayed overnight in motels the joy i got was from the feedom i felt and the real beauty of the country
angry,i cant remember being truly angry usually its just disappointment that i feel one situation would be with my brother he and i used to be close but now he seems to be avoiding me
sad,years ago my family decided to move from new york to california from the time we decided to move until the time we left i realized how much my friends cared for me when we left and for a long time after that i was very sad
happy,the last time i had sex
angry,physically fighting with my girlfriend because she just walked out of a room of my friends and had pushed and cursed at me when i went to find her
sad,hearing about a friend back home that had to have his stomach pumped because he had overdosed on pills
happy,reading a letter from a close friend who said he missed me and cared for me
angry,when a close friend did not write
sad,leaving high school
happy,i went home and visited with my family and friends
angry,while i was away for the weekend some friends went into my room and played my very expensive stereo without asking me or my roommate
sad,i asked a girl out on a date and she said no
happy,returning to school and rejoining my girlfriend after months of separation from summer
angry,i bought a new bed for my apt and it squeaks when you move on it i tried to fix it but could not
sad,finding out that my grandfather had died he lived in england and i had not seen him for years
happy,my boyfriend and i were getting dressed up and putting makeup on to go to a halloween party we were dressing up to be two mimes it was very enjoyable and i thought we looked really good it was an accomplishment we were alone in his house
angry,i had been searching for housing for fall at ucb and i was finally offered a place then an ordeal followed first i accepted then refused related to my parents judgment theyre paying for me turns out that i was so upset at what my dad said to me that i hung up on him he called back and threatened to cut me off financially and emotionally
sad,we got news that my almost years old brother died while visiting europe of a cerebral hemorhage it finally hit me an hour after we saw his corpse in the coffin it felt like a door between himself and everything had closed and locked forever
happy,when i found our my mother didnt have cancer
angry,when some friends betrayed my friendship
sad,when i did bad on a chamistry midterm which i could have done well
happy,riding home from school after completing two midterms in two days and feeling i did well on them
angry,argument with roommate over a lock he had put on kitchen cupboard without telling anyone
sad,day time robbery of our house
happy,when i found out i got accepted to berkeley
angry,when a friend carelessly broke and object in my parents house and did not apologize or pay or anything
sad,i felt sadness when my grandfather died
happy,on my birthday my closest friends were here at berkeley pithched in a lot of money each and bought me ten records to replace some of my records that were stolen they threw a small surprise party for me too
angry,i received a poor grade on a midterm even though i got all the right answers and knew the material i went to the ta to try to raise my grade and he wouldnt do it
sad,my girlfriend wanted to breakup for an indefinite amt of time she said that she couldnt commit herself fully to the relationship without going out with other people i was her first boyfriend
angry,a coworker and i had to rush a project i was only working there for one month and he for some years instead of letting me know that he wanted to do the project himself he went to the superviser and let the superviser tell me to let the coworker do it himself since he was quicker at it
sad,losing a pet chick our family had just put the chick outside a few days before and then one morning it was gone
happy,i experienced joy at a friends nd birthday party we had good food good liquid good company good music and an overall warm atmosphere the birthday girl and i communicate incredibly well i felt very content warm and inspired just talking with her giving her a neck massage
angry,i had just seen my pseudogirlfriend and our conversation angered me greatly
sad,my grandfather died thirteen years ago
happy,my parents and brother came up over the weekend we are a very close family this was my first year away from home they brought one jackolantern with a new design that is the old joke that we have a great new design its always the same
angry,while studying chemistry with a friend we became angry with eachother because we were both fed up
sad,i received a letter from my grandmother she has obviusly suffered a lot from my grandfathers suffering health she mentioned things she had gotten him and he would never use
happy,football was a very big deal at my high school so i was joyous when my schools team won the conference championship last year
angry,i was really pissed when the russians boycotted the olympics i had anger towards them and jimmy crter i was very anxious to see it
sad,it made me very sad to hear that some construction company was going to build houses on the beautiful hills by my house
happy,i took a math midterm and i knew i did really well and it was friday so i felt great joy because the week was over and i did well on a test
angry,when i was faced with writing an essay and i didnt want to do it i was angry that i had to write an essay and angry at myself for not having the time to write a good essay
sad,i ran a race for the cal track team and i did terribly and then the coach said that i should sit out for the season i felt really sad because i wasnt going to be able to run it was something i always had done and now i couldnt do it anymore
happy,i had met someone and we became good friends our relationship grew closer and now he is my boyfriend i felt joy when i found out how he felt about me
angry,one of my friends kept criticizing me about everything i did i thought she was kidding but later i found out that she was serious
sad,one of my relatives became seriously ill i felt sad because i didnt know if she will ever be the same again
happy,i spoke with a friend on the phone who i havent seen in many years it was a joyful event to talk to him
angry,i typed up a letter for this physician at work she didnt care for my style even though she was not using correct english i told her it was her letter and we would do it her way
sad,recently my sisterinlaws horse was poisoned by a plant and died the horse was very obedient and exceptional with children
happy,my old boyfriend yes the same one asked me out we had a good time then he asked me out the following week he actually took interest
angry,my boyfriend breaking up with me about months after i had an abortion just the fact that he was ignoring me and continued to do so
sad,my nephews mother just left one day my brother and she were not married my nephew anthony was shaken i was sad for him because a similar situation happened to me
happy,when i got accepted to cal
angry,when my roommates boyfriend assaulted me he was threatening me calling me names and pushing me around
sad,i was going to go on a vacation to texas this summer but was unable to go because of registration
happy,after being depressed because of a very bad relationship my first love called me and told me that he would always care for me no matter what i did
angry,when someone tried to rape one of my best friends and he claimed it was her fault he the hassled her claimed she was loose and threatened to sue her
sad,my mother kicked my surrogate father out and he in turn did not care for the dog afthur he bought for the family his lack of concern lead tho arthurs death on the freeway i loved arthur like a brother he was easy to talk to
happy,i spent a lovely relaxing evening with my boyfriend we played games and talked all evening
angry,when my roommates moped was stolen i was very angry
sad,when i heard my grandfathers wife had leukemia i was very sad
happy,third highest grade in the class and the best answer given for one question the question was graded by the professor and he indicated he liked my answer
angry,we are repainting rooms in my house my mother started to enact plans to paint my room without consulting me
sad,recent breakup with my girlfriend we had been together for over a year i was overseas and discovered over the phone while i was at work
happy,after watching the ers lose game after game year after year i was finally rewarded with a super bowl victory which made me extremely happy
angry,i was rushing home from school because there was a er game that night i got into a noninjury accident which was all my fault but destroyed the front of my car the truck i hit was undamaged
sad,when i learned that my dad had cancer i knew he was going to the hospital for some tests my mom told me when she picked me up one weekend from cal to take me home
happy,i felt joy when my boyfriend proposed to me in marriage
angry,after i said something that my boyfriend disagreed with he walked away from me without discussing what bothered him i became very angry with him for treating me this way yesterday november
sad,i felt sad when my boyfriend and i were apart for some time
happy,after much trouble getting together in the first place my boyfriend and i celebrated our first anniversary
angry,sometimes when i go to work my crazy boss a hyper jewish lawyer insists i do things his way filing typing etc he sometimes blames me for things i didnt do and i cant yell back at him
sad,since i moved into the dorms and ive been spending most of my free time with my boyfriend i hardly see my old high school friends i had several bad incidents with my past best friends
happy,winning a close volleyball game im on the intercollegiate team at cal
angry,same situation as before having my car stolen
sad,when a close friend drowned in the american river
happy,getting sent on a company expense trip to another state to work for a week at that plan
angry,having my personal objects rearranged by someone else without my consent and having it arranged to their taste then trying to find a particular object they rearranged for an hour or more
sad,death of my father
happy,when i finished my cs project i was overjoyed i felt relieved because it was due the next day and i was tired of looking at it
angry,i came out of the house at am monday morning getting ready t go to school and fight for a parking when i saw my car had a flat tire
sad,after my little sisters graduation from high school my grandmother became very sick she passed away a few months later
happy,a party with no worries ie no tests homework etc many friends were present and good music
angry,i was stood up for a date function by someone who i really cared for
sad,after blowing up and saying all the wrong things i realized what i had done and hurt that person and myself
happy,i realized the girl liked to be with me
angry,when my dad told me about something he had done against my mother
sad,when i heard my sister got in a bad car accident
happy,when i passed the ba exams with first class results
angry,when i failed my ssc exam
sad,when my sister left home to go and live with her husband
happy,my first feeling of falling in love coming across a person who made me feel love happiness joy giving me a new and beautiful future who made me dream
angry,i was angry at my brother over an argument we had together we do have a few fights from time to time and also at times i take out my anger on him
sad,when i came to know that my feelings for someone were not reciprocated
happy,after my marriage i received the bsc results by post i was very happy to learn that i had got very good marks first class
angry,i felt angry when my motherinlaw did not handle my daughter properly and she fell down from the bed and hurt her head
sad,i was very sad when i could not take the ma i exams due to illness and a relative of mine disheartened me about it
happy,when my family allowed me to do higher studies
angry,when my father talks about our relatives and favours them i feel angry
sad,when my elders do not understand me in the right way
happy,i went for a walk on the beach with a friend whom i had not seen for many months the weather was very pleasant we had some icecream and lots of fun on the beach
angry,i was walking on a street alone in the afternoon when there were not too many people on the street a couple of guys were following me and i was ignoring them suddenly one of them came in front of me and started using dirty language and harrassing me i got very angry and wanted to strike back at them
sad,a close friend of mine was to get married in a weeks time when her father died of a heartattack i knew him well and felt bad on hearing of his death
happy,when i got permission to study at a place which was far away from my home
angry,i feel angry when somebody is unjust to me
sad,i feel sad when somebody is unjust to me
happy,when i went for a picnic in lonavala i felt full of joy
angry,i was angry this morning when i missed the train to university
sad,when i missed my train this morning i felt sad for some time
happy,i acted in an english play in college and got the best actress award while our play got the first place
angry,i was to meet a friend at the busstop he was coming to visit us and he did not turn up after having waited for him for some time about an hour i called him up to be told that he did not intend to come as he was feeling tired
sad,when my sister died in a fire accident at home
happy,when i passsed the msc board exams with first class which i had not expected
angry,when my friend promised that she would come to my place and did not turn up i was annoyed at her
sad,when someone tells me something that hurts me i feel bad about it and also feel sad
happy,i was very happy when i passed the ba with first class marks
angry,i was having an argument with my brother on his behavior then we started fighting and i got annoyed at him because he started teasing me
sad,my best friend got married and left her hometown to go and live in poona after her wedding i felt sad
happy,when i passed the ba exams with first class results
angry,when i failed the msc exams
sad,when my father was ill
happy,last year i passed the ba exams in psychology in which i stood first in my class thus i got the first prize from the college i was most happy to tell all this to my parents and friends
angry,a few months ago when i was teaching i suddenly became very angry at the children and slapped some of them
sad,my friend got married and went abroad this made me feel sad and lonely
happy,when i got a first class in the twelveth standard exams i was very surprised and happy and i had a very good time with my friends
angry,when i was at sybajaj i wanted to get admission in another college and this was not easy and i felt angry
sad,when my mother scolded me for something very insignificant without knowing the real cause of what had happened
happy,after completing highschool i wanted to go abroad for a holiday i had never been abroad before and neither had i taken a holiday for a long time when finally my parents agreed and we got the airplane tickets i was over joyed
sad,when i see people with burns i feel sad actually i can not even express my feelings as i think that they must suffer a lot
happy,day before yesterday my mother bought me a new pair of shoes without my having asked for them she told me that when she saw the pair of shoes she felt like buying them for me i really liked the shoes and they made me feel that my mother cares for me
angry,one of my friends asked me to go shopping with her another friend of hers was also coming along during the outing they kept talking to each other and i felt left out even when i tried to talk to them they seemed not to listen to me and did not pay me much attention
sad,two years ago my best friend died in an accident just a day before my birthray we were very close to each other and i felt very sad at loosing a close friend
happy,when my daughter gave her solo dance performance in poona and there was a big applause i was overjoyed
angry,i am separated from my husband the way he has behaved towards me makes me angry
sad,when my husband lied to me tricked me and when i had to leave my home
happy,when i got married
angry,a girl whom i trusted and with whom i had shared personal confidential matters twisted the facts and told it to a common friend of ours when this common friend told me the version my friend had told her i was angry
sad,when my elder sister died
happy,the day i got married was the happiest day of my life both of us felt that we were right for each other in every way and we had no doubts about our compatibility right from the day we got engaged
angry,one morning i was standing at the busstop and the bus passed by without stopping even though there were only passengers inside i felt angry at the rude behaviour of the bus driver and conductor
sad,at the death of my friends father and especially as this happened ten days before her wedding
happy,when i succeeded in achieving a scholarship for which i had strived hard during a period of financial personal and physical stress
